{
  "schema_version": "1.1.0",
  "project": {"id": "project-001", "name": "Example", "root": "."},
  "modules": [
    {"id": "MOD-001", "name": "Requirements", "required": true, "status": "existing", "evidence": ["docs/requirements.md"], "confidence": "verified", "notes": ""}
  ],
  "recommendations": {"mvp": ["MOD-001"], "go_live": [], "future": [], "decision_status": "proposed"},
  "open_questions": [],
  "change_log": []
}
